{
  "$schema": "https://json-schema.org/draft/2020-12/schema",
  "title": "Blind Lean translation",
  "type": "object",
  "additionalProperties": false,
  "required": ["schema_version", "role", "dossier_sha256", "dependency_coverage", "translation", "restrictions_and_vacuity_risks", "ambiguities"],
  "properties": {
    "schema_version": {"const": "formalization-faithfulness-1"},
    "role": {"const": "blind-translation"},
    "dossier_sha256": {"$ref": "#/$defs/sha256"},
    "dependency_coverage": {"type": "array", "minItems": 1, "items": {"oneOf": [{"$ref": "#/$defs/reviewedDependency"}, {"$ref": "#/$defs/reusedDependency"}]}},
    "translation": {
      "type": "object",
      "additionalProperties": false,
      "required": ["binders", "hypotheses", "conclusions", "mathematical_definitions", "proposition_plain_english"],
      "properties": {
        "binders": {"$ref": "#/$defs/stringArray"},
        "hypotheses": {"$ref": "#/$defs/stringArray"},
        "conclusions": {"$ref": "#/$defs/nonemptyStringArray"},
        "mathematical_definitions": {"$ref": "#/$defs/stringArray"},
        "proposition_plain_english": {"type": "string", "minLength": 1}
      }
    },
    "restrictions_and_vacuity_risks": {"$ref": "#/$defs/stringArray"},
    "ambiguities": {"$ref": "#/$defs/stringArray"}
  },
  "$defs": {
    "sha256": {"type": "string", "pattern": "^[0-9a-f]{64}$"},
    "stringArray": {"type": "array", "items": {"type": "string", "minLength": 1}},
    "nonemptyStringArray": {"type": "array", "minItems": 1, "items": {"type": "string", "minLength": 1}},
    "reviewedDependency": {
      "type": "object",
      "additionalProperties": false,
      "required": ["id", "name", "meaning", "effect_on_target", "status"],
      "properties": {
        "id": {"type": "string", "pattern": "^D[0-9]{3}$"},
        "name": {"type": "string", "minLength": 1},
        "meaning": {"type": "string", "minLength": 1},
        "effect_on_target": {"type": "string", "minLength": 1},
        "status": {"enum": ["understood", "unclear"]}
      }
    },
    "reusedDependency": {
      "type": "object",
      "additionalProperties": false,
      "required": ["id", "name", "reuse_sha256", "effect_on_target", "status"],
      "properties": {
        "id": {"type": "string", "pattern": "^D[0-9]{3}$"},
        "name": {"type": "string", "minLength": 1},
        "reuse_sha256": {"$ref": "#/$defs/sha256"},
        "effect_on_target": {"type": "string", "minLength": 1},
        "status": {"enum": ["understood", "unclear"]}
      }
    }
  }
}
