{"schema_version":"formalization-faithfulness-1","role":"blind-translation","dossier_sha256":"83783b61c2e4de9f1efbc5b667e5b06c82f8574cc607a4b3cf72fb601b97e539","dependency_coverage":[{"id":"D001","name":"DivInvMonoid.toDiv","meaning":"Division projection.","effect_on_target":"Supplies real division.","status":"understood"},{"id":"D002","name":"Eq","meaning":"Equality.","effect_on_target":"Equates the functions.","status":"understood"},{"id":"D003","name":"HDiv.hDiv","meaning":"Division application.","effect_on_target":"Forms (-x²)/2.","status":"understood"},{"id":"D004","name":"HMul.hMul","meaning":"Multiplication application.","effect_on_target":"Forms 2π and products.","status":"understood"},{"id":"D005","name":"HPow.hPow","meaning":"Power application.","effect_on_target":"Forms x².","status":"understood"},{"id":"D006","name":"Inv.inv","meaning":"Multiplicative inverse.","effect_on_target":"Forms 1/√(2π).","status":"understood"},{"id":"D007","name":"Monoid.toNatPow","meaning":"Natural monoid powers.","effect_on_target":"Interprets x².","status":"understood"},{"id":"D008","name":"NNReal","meaning":"Nonnegative reals.","effect_on_target":"Types parameter 1.","status":"understood"},{"id":"D009","name":"Nat","meaning":"Natural numbers.","effect_on_target":"Types exponent 2.","status":"understood"},{"id":"D010","name":"Nat.instAtLeastTwoHAddOfNat","meaning":"At-least-two evidence.","effect_on_target":"Supports numeral 2.","status":"understood"},{"id":"D011","name":"Nat.instNeZeroSucc","meaning":"Successor nonzero evidence.","effect_on_target":"Supports numeral 2.","status":"understood"},{"id":"D012","name":"Neg.neg","meaning":"Negation.","effect_on_target":"Forms -x².","status":"understood"},{"id":"D013","name":"OfNat.ofNat","meaning":"Numeral interpretation.","effect_on_target":"Interprets 0, 1, and 2.","status":"understood"},{"id":"D014","name":"One.toOfNat1","meaning":"One-to-numeral instance.","effect_on_target":"Forms NNReal 1.","status":"understood"},{"id":"D015","name":"ProbabilityTheory.gaussianPDFReal","meaning":"gaussianPDFReal μ v x=(1/√(2πv))·exp(-(x-μ)²/(2v)).","effect_on_target":"At μ=0,v=1 gives the left side.","status":"understood"},{"id":"D016","name":"Real","meaning":"Real numbers.","effect_on_target":"Types domain, codomain, and arithmetic.","status":"understood"},{"id":"D017","name":"Real.exp","meaning":"Real exponential.","effect_on_target":"Forms exp(-x²/2).","status":"understood"},{"id":"D018","name":"Real.instDivInvMonoid","meaning":"Real division/inverse structure.","effect_on_target":"Supplies division by 2.","status":"understood"},{"id":"D019","name":"Real.instInv","meaning":"Real inversion.","effect_on_target":"Forms the reciprocal prefactor.","status":"understood"},{"id":"D020","name":"Real.instMonoid","meaning":"Real multiplicative monoid.","effect_on_target":"Supplies natural powers.","status":"understood"},{"id":"D021","name":"Real.instMul","meaning":"Real multiplication.","effect_on_target":"Forms 2π and the final product.","status":"understood"},{"id":"D022","name":"Real.instNatCast","meaning":"Natural-to-real cast.","effect_on_target":"Forms real 2.","status":"understood"},{"id":"D023","name":"Real.instNeg","meaning":"Real negation.","effect_on_target":"Forms -x².","status":"understood"},{"id":"D024","name":"Real.instZero","meaning":"Real zero.","effect_on_target":"Forms mean 0.","status":"understood"},{"id":"D025","name":"Real.pi","meaning":"π.","effect_on_target":"Appears in √(2π).","status":"understood"},{"id":"D026","name":"Real.sqrt","meaning":"Real square root.","effect_on_target":"Forms √(2π).","status":"understood"},{"id":"D027","name":"Zero.toOfNat0","meaning":"Zero-to-numeral instance.","effect_on_target":"Forms real 0.","status":"understood"},{"id":"D028","name":"instHDiv","meaning":"Homogeneous division instance.","effect_on_target":"Enables real division.","status":"understood"},{"id":"D029","name":"instHMul","meaning":"Homogeneous multiplication instance.","effect_on_target":"Enables real multiplication.","status":"understood"},{"id":"D030","name":"instHPow","meaning":"Homogeneous power instance.","effect_on_target":"Enables x².","status":"understood"},{"id":"D031","name":"instOfNatAtLeastTwo","meaning":"Large-numeral instance.","effect_on_target":"Forms real 2.","status":"understood"},{"id":"D032","name":"instOfNatNat","meaning":"Natural numeral instance.","effect_on_target":"Forms natural literals.","status":"understood"},{"id":"D033","name":"instOneNNReal","meaning":"NNReal one instance.","effect_on_target":"Forms parameter 1.","status":"understood"}],"translation":{"binders":["x:ℝ (lambda-bound)"],"hypotheses":[],"conclusions":["gaussianPDFReal 0 1 = (x ↦ (1/√(2π))·exp(-x²/2))."],"mathematical_definitions":["gaussianPDFReal μ v x=(1/√(2πv))·exp(-(x-μ)²/(2v))."],"proposition_plain_english":"The zero-mean, unit-parameter Gaussian density is the standard normal density."},"restrictions_and_vacuity_risks":["No hypotheses; equality holds for all real x; parameters are fixed at 0 and 1."],"ambiguities":[]}
