{
  "schema_version": "formalization-faithfulness-1",
  "role": "blind-translation",
  "dossier_sha256": "5be611db408759e0c6af00218dce951690208fa9222fdaea27defa1f367d01f9",
  "dependency_coverage": [
    {"id":"D001","name":"LocalDef001","meaning":"The pushforward measure of X evaluated on the lower interval (-∞, t], equivalently the cumulative distribution value at t.","effect_on_target":"Forms the lower-tail term subtracted from one on the right-hand side.","status":"understood"},
    {"id":"D002","name":"LocalDef002","meaning":"The pushforward measure of X evaluated on the strict upper interval (t, ∞).","effect_on_target":"Forms the upper-tail probability on the left-hand side.","status":"understood"},
    {"id":"D003","name":"LocalDef003","meaning":"The pushforward of μ along X, i.e. the distribution or law of X on the real numbers.","effect_on_target":"Supplies the common measure used by both interval probabilities.","status":"understood"},
    {"id":"D004","name":"AEMeasurable","meaning":"X agrees μ-almost everywhere with a measurable real-valued function.","effect_on_target":"Provides the measurability condition needed to interpret the pushforward distribution and its interval probabilities.","status":"understood"},
    {"id":"D005","name":"AddCommMonoidWithOne.toAddMonoidWithOne","meaning":"Forgets commutativity from an additive commutative monoid-with-one structure.","effect_on_target":"Participates only in elaborating the ENNReal numeral one.","status":"understood"},
    {"id":"D006","name":"AddMonoidWithOne.toOne","meaning":"Extracts the distinguished multiplicative numeral one from an additive monoid-with-one structure.","effect_on_target":"Participates only in elaborating the ENNReal numeral one.","status":"understood"},
    {"id":"D007","name":"ENNReal","meaning":"The extended nonnegative real numbers, including infinity.","effect_on_target":"Is the codomain of both measure values and of the subtraction in the conclusion.","status":"understood"},
    {"id":"D008","name":"ENNReal.instSub","meaning":"The subtraction operation on extended nonnegative reals, understood as truncated subtraction.","effect_on_target":"Interprets the expression one minus the lower-tail measure.","status":"understood"},
    {"id":"D009","name":"Eq","meaning":"Propositional equality.","effect_on_target":"Asserts exact equality between the upper-tail measure and the complementary lower-tail expression.","status":"understood"},
    {"id":"D010","name":"HSub.hSub","meaning":"The generic subtraction operation selected through a heterogeneous-subtraction instance.","effect_on_target":"Applies ENNReal subtraction to one and LocalDef001.","status":"understood"},
    {"id":"D011","name":"MeasurableSpace","meaning":"A sigma-algebra specifying the measurable subsets of Ω.","effect_on_target":"Provides the measurable structure required for μ and the almost-everywhere measurability of X.","status":"understood"},
    {"id":"D012","name":"MeasureTheory.IsProbabilityMeasure","meaning":"The assertion that μ has total mass one.","effect_on_target":"Makes the measure of a measurable event complement equal to one minus the event's measure.","status":"understood"},
    {"id":"D013","name":"MeasureTheory.Measure","meaning":"A countably additive ENNReal-valued measure on a measurable space.","effect_on_target":"Types the original measure μ and the pushforward measure representing the law of X.","status":"understood"},
    {"id":"D014","name":"OfNat.ofNat","meaning":"The generic interpretation of a natural-number literal in a target type.","effect_on_target":"Interprets the literal 1 as an ENNReal value.","status":"understood"},
    {"id":"D015","name":"One.toOfNat1","meaning":"Builds the numeral-one interpretation from a type's One instance.","effect_on_target":"Supports the ENNReal literal one in the complementary-probability expression.","status":"understood"},
    {"id":"D016","name":"Real","meaning":"The real-number type.","effect_on_target":"Is the codomain of X and the type of the threshold t.","status":"understood"},
    {"id":"D017","name":"Real.measurableSpace","meaning":"The Borel measurable structure on the real numbers.","effect_on_target":"Determines measurable real-valued functions and the measurable structure of the pushforward distribution.","status":"understood"},
    {"id":"D018","name":"instAddCommMonoidWithOneENNReal","meaning":"The additive commutative monoid-with-one structure on ENNReal.","effect_on_target":"Supplies the algebraic structure used to elaborate the ENNReal numeral one.","status":"understood"},
    {"id":"D019","name":"instHSub","meaning":"Constructs homogeneous heterogeneous subtraction from a type's subtraction operation.","effect_on_target":"Selects ENNReal subtraction for the right-hand side.","status":"understood"},
    {"id":"D020","name":"DFunLike.coe","meaning":"Coerces a function-like object to its underlying dependent function.","effect_on_target":"Supports evaluating a measure as a function on a set.","status":"understood"},
    {"id":"D021","name":"MeasureTheory.Measure.instFunLike","meaning":"The function-like structure that lets a measure be evaluated on measurable-space subsets.","effect_on_target":"Evaluates the pushforward measure on Set.Iic t and Set.Ioi t.","status":"understood"},
    {"id":"D022","name":"Real.instPreorder","meaning":"The usual preorder on the real numbers.","effect_on_target":"Determines the inequalities defining the lower and upper intervals.","status":"understood"},
    {"id":"D023","name":"Set","meaning":"A set of elements, represented as a predicate.","effect_on_target":"Types the real intervals on which the pushforward measure is evaluated.","status":"understood"},
    {"id":"D024","name":"Set.Iic","meaning":"The interval of real numbers x satisfying x ≤ t.","effect_on_target":"Defines the event used for the cumulative lower-tail probability.","status":"understood"},
    {"id":"D025","name":"Set.Ioi","meaning":"The interval of real numbers x satisfying t < x.","effect_on_target":"Defines the strict upper-tail event in the conclusion.","status":"understood"},
    {"id":"D026","name":"MeasureTheory.Measure.map","meaning":"Pushes a measure forward along a function.","effect_on_target":"Turns μ and X into the distribution of X whose lower and upper interval masses are compared.","status":"understood"}
  ],
  "translation": {
    "binders": [
      "A type Ω equipped with a measurable-space structure.",
      "A measure μ on Ω equipped with the assertion that μ is a probability measure.",
      "A function X : Ω → Real.",
      "A real threshold t."
    ],
    "hypotheses": ["X is μ-almost-everywhere measurable."],
    "conclusions": [
      "The pushforward measure of X on (t, ∞) equals one minus its measure on (-∞, t].",
      "Equivalently, μ(X > t) = 1 - μ(X ≤ t)."
    ],
    "mathematical_definitions": [
      "LocalDef003 μ X is the pushforward measure map X μ, namely the distribution of X.",
      "LocalDef001 μ X t is (map X μ)((-∞, t]).",
      "LocalDef002 μ X t is (map X μ)((t, ∞))."
    ],
    "proposition_plain_english": "On a probability space, for every almost-everywhere measurable real-valued random variable X and every real threshold t, the probability that X is strictly greater than t is one minus the probability that X is at most t."
  },
  "restrictions_and_vacuity_risks": [
    "The upper event is strict, X > t, while the complementary lower event includes the threshold, X ≤ t; any atom at t belongs entirely to the lower event.",
    "The subtraction is ENNReal truncated subtraction. The probability-measure assumption ensures the lower-event mass is at most one, so it has the intended complementary-probability meaning.",
    "Only almost-everywhere measurability is assumed; no integrability, continuity, or strict pointwise measurability hypothesis is present.",
    "The statement concerns the unconditional pushforward distribution of X and contains no independence, conditioning, or tail-bound assertion.",
    "There is no apparent vacuity: probability measures and almost-everywhere measurable real-valued functions provide ordinary inhabited instances of the quantified setting."
  ],
  "ambiguities": []
}
