{
  "schema_version": "formalization-faithfulness-1",
  "role": "blind-translation",
  "dossier_sha256": "f17356b7b7802f5ad161fb4385897f23f4b6e801f6cb04c27b9dd165fd56fe3f",
  "dependency_coverage": [
    {"id":"D001","name":"AddCommMonoidWithOne.toAddMonoidWithOne","meaning":"Projects an additive monoid-with-one structure from an additive commutative monoid-with-one structure.","effect_on_target":"Supplies part of the typeclass chain used to interpret the constant 1 in ENNReal.","status":"understood"},
    {"id":"D002","name":"AddMonoidWithOne.toOne","meaning":"Projects the distinguished-one structure from an additive monoid-with-one structure.","effect_on_target":"Supplies the One ENNReal instance used to interpret the indicator's value 1.","status":"understood"},
    {"id":"D003","name":"ENNReal","meaning":"The extended nonnegative real numbers, implemented as nonnegative reals with a top element.","effect_on_target":"It is the codomain of the indicator integrand and of both lower Lebesgue integrals.","status":"understood"},
    {"id":"D004","name":"Eq","meaning":"Propositional equality between two values of the same type.","effect_on_target":"States that the two iterated ENNReal-valued integrals are equal.","status":"understood"},
    {"id":"D005","name":"Measurable","meaning":"A function is measurable when inverse images of measurable sets are measurable.","effect_on_target":"Expresses the sole explicit hypothesis on X and supports measurability of the integrand.","status":"understood"},
    {"id":"D006","name":"MeasurableSpace","meaning":"A measurable-space structure specifying the measurable subsets of a type.","effect_on_target":"Equips Ω with the measurable structure needed to define μ, measurability, and integration.","status":"understood"},
    {"id":"D007","name":"MeasureTheory.IsProbabilityMeasure","meaning":"The property that a measure is a probability measure.","effect_on_target":"Restricts μ to have total mass one.","status":"understood"},
    {"id":"D008","name":"MeasureTheory.Measure","meaning":"A measure on a type equipped with a measurable space.","effect_on_target":"Provides the measure μ used for integration over Ω.","status":"understood"},
    {"id":"D009","name":"MeasureTheory.Measure.restrict","meaning":"Restricts a measure to a specified set.","effect_on_target":"Restricts real volume to the positive half-line Set.Ioi 0 in both iterated integrals.","status":"understood"},
    {"id":"D010","name":"MeasureTheory.MeasureSpace.toMeasurableSpace","meaning":"Extracts the measurable-space component of a measure-space instance.","effect_on_target":"Provides the measurable structure on Real used by the restricted volume measure and its integral.","status":"understood"},
    {"id":"D011","name":"MeasureTheory.MeasureSpace.volume","meaning":"Extracts the distinguished volume measure from a measure-space instance.","effect_on_target":"Provides the real volume measure that is restricted to positive real numbers.","status":"understood"},
    {"id":"D012","name":"MeasureTheory.lintegral","meaning":"The lower Lebesgue integral of an ENNReal-valued function.","effect_on_target":"Forms both integrations over Ω and positive real t and permits possibly infinite values.","status":"understood"},
    {"id":"D013","name":"OfNat.ofNat","meaning":"Interprets a natural-number literal in a type carrying the appropriate OfNat instance.","effect_on_target":"Interprets the literals 0 in Real and 1 in ENNReal.","status":"understood"},
    {"id":"D014","name":"One.toOfNat1","meaning":"Constructs interpretation of the numeral 1 from a One structure.","effect_on_target":"Makes the constant value 1 of the ENNReal-valued indicator well typed.","status":"understood"},
    {"id":"D015","name":"Real","meaning":"The type of real numbers.","effect_on_target":"It is the codomain of X and the domain of the auxiliary integration variable t.","status":"understood"},
    {"id":"D016","name":"Real.instPreorder","meaning":"The standard preorder structure on the real numbers.","effect_on_target":"Interprets the inequalities t < X(ω) and 0 < t defining the two open intervals.","status":"understood"},
    {"id":"D017","name":"Real.instZero","meaning":"The standard zero element of the real numbers.","effect_on_target":"Provides the endpoint 0 of the positive half-line Set.Ioi 0.","status":"understood"},
    {"id":"D018","name":"Real.measurableSpace","meaning":"The Borel measurable-space structure on the real numbers.","effect_on_target":"Determines what it means for X to be measurable as a real-valued function.","status":"understood"},
    {"id":"D019","name":"Real.measureSpace","meaning":"The canonical measure-space instance on the real numbers.","effect_on_target":"Provides the real measurable structure and volume measure used for integration in t.","status":"understood"},
    {"id":"D020","name":"Set.Iio","meaning":"The open lower interval consisting of elements strictly less than a given endpoint.","effect_on_target":"For each ω, defines the set of t satisfying t < X(ω), whose indicator is integrated.","status":"understood"},
    {"id":"D021","name":"Set.Ioi","meaning":"The open upper interval consisting of elements strictly greater than a given endpoint.","effect_on_target":"Defines the positive real domain t > 0 to which volume is restricted.","status":"understood"},
    {"id":"D022","name":"Set.indicator","meaning":"Returns a function's value on a set and zero outside that set.","effect_on_target":"Creates the ENNReal-valued function equal to 1 when t < X(ω) and 0 otherwise.","status":"understood"},
    {"id":"D023","name":"Zero.toOfNat0","meaning":"Constructs interpretation of the numeral 0 from a Zero structure.","effect_on_target":"Makes the endpoint 0 of Set.Ioi 0 well typed as a real number.","status":"understood"},
    {"id":"D024","name":"instAddCommMonoidWithOneENNReal","meaning":"The additive commutative monoid-with-one structure on ENNReal.","effect_on_target":"Supports the typeclass chain that interprets the ENNReal constant 1.","status":"understood"},
    {"id":"D025","name":"instZeroENNReal","meaning":"The zero structure on ENNReal.","effect_on_target":"Supplies the value returned by the indicator outside Set.Iio (X ω).","status":"understood"}
  ],
  "translation": {
    "binders": ["Ω is an arbitrary type equipped with a measurable-space structure.","μ is a measure on Ω.","μ is equipped with the assumption that it is a probability measure.","X is a real-valued function on Ω."],
    "hypotheses": ["X is measurable from Ω to the Borel measurable space on the real numbers."],
    "conclusions": ["The lower Lebesgue integral over ω with respect to μ of the lower Lebesgue integral over positive real t of the indicator of t < X(ω) equals the same double integral with the t- and ω-integrations reversed."],
    "mathematical_definitions": ["Let ν be real volume restricted to the open positive half-line (0, ∞).","Define F(ω,t) in ENNReal by F(ω,t) = 1 when t < X(ω), and F(ω,t) = 0 otherwise.","The asserted equality is ∫⁻_Ω (∫⁻_(0,∞) F(ω,t) dν(t)) dμ(ω) = ∫⁻_(0,∞) (∫⁻_Ω F(ω,t) dμ(ω)) dν(t)."],
    "proposition_plain_english": "For every measurable real random variable X on a probability space, integrating the nonnegative indicator that a positive level t lies below X(ω) first over levels and then over outcomes gives the same extended nonnegative value as integrating first over outcomes and then over levels."
  },
  "restrictions_and_vacuity_risks": ["The level variable t is integrated only over the strict positive half-line, so the integrand records the positive-level portion of X and does not include negative levels.","The inequality is strict: the indicator is 1 exactly when t < X(ω).","Both sides are ENNReal-valued lower integrals and may equal infinity; the statement does not assert finiteness or ordinary integrability.","No assumption that X is nonnegative, bounded, or integrable is present.","The probability-measure assumption restricts applicability, although the displayed nonnegative order-exchange equality itself resembles a result valid under more general measure hypotheses.","For choices of Ω and μ admitting no IsProbabilityMeasure instance, there is no applicable instantiation of the universally quantified statement."],
  "ambiguities": ["Calling the result Fubini versus Tonelli is terminological; its ENNReal-valued nonnegative integrand makes the displayed claim Tonelli-type.","The mathematical reading treats the canonical real volume supplied by Real.measureSpace as Lebesgue volume."]
}
