{
  "schema_version": "formalization-faithfulness-1",
  "role": "blind-translation",
  "dossier_sha256": "150b5661cd261989e852d88f243f040c7a211e6ee1d0111d80377575aabb0116",
  "dependency_coverage": [
    {"id":"D001","name":"DFunLike.coe","meaning":"Coerces a function-like object to its represented function.","effect_on_target":"Allows each measure to be evaluated on Set.Iic t.","status":"understood"},
    {"id":"D002","name":"ENNReal","meaning":"Extended nonnegative real numbers including infinity.","effect_on_target":"Provides the codomain of measure values.","status":"understood"},
    {"id":"D003","name":"Eq","meaning":"Equality of terms of the same type.","effect_on_target":"Expresses equality of interval masses and of measures.","status":"understood"},
    {"id":"D004","name":"Iff","meaning":"Logical equivalence.","effect_on_target":"Equates agreement on all lower intervals with equality of measures.","status":"understood"},
    {"id":"D005","name":"MeasureTheory.IsProbabilityMeasure","meaning":"The measure is a probability measure.","effect_on_target":"Restricts both measures to probability measures.","status":"understood"},
    {"id":"D006","name":"MeasureTheory.Measure","meaning":"A measure on a measurable type.","effect_on_target":"Supplies the types of mu and nu.","status":"understood"},
    {"id":"D007","name":"MeasureTheory.Measure.instFunLike","meaning":"The function-like structure for measure evaluation.","effect_on_target":"Interprets mu(Set.Iic t) and nu(Set.Iic t).","status":"understood"},
    {"id":"D008","name":"Real","meaning":"The real-number type.","effect_on_target":"Provides the measured space and threshold type.","status":"understood"},
    {"id":"D009","name":"Real.instPreorder","meaning":"The usual order on real numbers.","effect_on_target":"Forms the condition x <= t.","status":"understood"},
    {"id":"D010","name":"Real.measurableSpace","meaning":"The Borel measurable structure on reals.","effect_on_target":"Makes mu and nu Borel measures on the real line.","status":"understood"},
    {"id":"D011","name":"Set","meaning":"A subset represented by a membership predicate.","effect_on_target":"Provides the objects on which measures are evaluated.","status":"understood"},
    {"id":"D012","name":"Set.Iic","meaning":"The lower closed interval {x | x <= t}.","effect_on_target":"Defines the determining family of sets.","status":"understood"}
  ],
  "translation": {
    "binders": [
      "Two measures mu and nu on the Borel real line.",
      "Every real threshold t."
    ],
    "hypotheses": [
      "mu is a probability measure.",
      "nu is a probability measure."
    ],
    "conclusions": [
      "Agreement of mu and nu on every lower closed interval implies mu = nu.",
      "Equality mu = nu implies agreement on every lower closed interval."
    ],
    "mathematical_definitions": [
      "Set.Iic t is (-infinity,t].",
      "Measure evaluation returns an extended nonnegative real.",
      "A probability measure has total mass one."
    ],
    "proposition_plain_english": "Two Borel probability measures on the real line are equal exactly when they assign the same mass to every lower closed interval."
  },
  "restrictions_and_vacuity_risks": [
    "The statement is restricted to probability measures on the Borel real line.",
    "Agreement is required at every real threshold and specifically on inclusive lower intervals.",
    "The reverse implication is immediate; the substantive direction is uniqueness.",
    "Probability measures on the real line exist, so the statement is nonvacuous."
  ],
  "ambiguities": []
}
