{"schema_version":"formalization-faithfulness-1","role":"blind-translation","dossier_sha256":"0b20f2bcf4f6a33a6fac4fc63d7e8177c1073be9935257e8a227c96a5d170196","dependency_coverage":[{"id":"D001","name":"Eq","meaning":"Equality relates two values of the same type.","effect_on_target":"It asserts that the real product 0 * r is equal to the real number 1 inside the existential claim.","status":"understood"},{"id":"D002","name":"Exists","meaning":"Existential quantification asserts that at least one value of a specified type satisfies a predicate.","effect_on_target":"It quantifies over a real number r satisfying 0 * r = 1.","status":"understood"},{"id":"D003","name":"HMul.hMul","meaning":"This operation extracts heterogeneous multiplication from an HMul instance; here its input and output types are all Real.","effect_on_target":"It forms the real-valued product 0 * r on the left side of the equality.","status":"understood"},{"id":"D004","name":"Not","meaning":"Negation of a proposition P is defined as P implying False.","effect_on_target":"It denies the entire existential proposition, asserting that the alleged real witness cannot exist.","status":"understood"},{"id":"D005","name":"OfNat.ofNat","meaning":"This operation interprets a natural-number literal as a value of a type through an OfNat instance.","effect_on_target":"It interprets the literals 0 and 1 as real numbers using the selected real zero and one instances.","status":"understood"},{"id":"D006","name":"One.toOfNat1","meaning":"This definition constructs the interpretation of the numeral 1 from a type's distinguished One value.","effect_on_target":"It ensures that the right side of the equality is the distinguished real number 1.","status":"understood"},{"id":"D007","name":"Real","meaning":"Real is the type over which the existential variable ranges and in which the multiplication and equality are evaluated.","effect_on_target":"It restricts the claimed nonexistence of a solution to real-valued r.","status":"understood"},{"id":"D008","name":"Real.instMul","meaning":"This is the multiplication structure on Real, whose operation is the primitive real multiplication Real.mul✝.","effect_on_target":"It fixes the multiplication in 0 * r to be real multiplication.","status":"understood"},{"id":"D009","name":"Real.instOne","meaning":"This is the distinguished-one structure on Real, whose value is the primitive real one Real.one✝.","effect_on_target":"It supplies the real value denoted by the numeral 1 on the right side of the equation.","status":"understood"},{"id":"D010","name":"Real.instZero","meaning":"This is the distinguished-zero structure on Real, whose value is the primitive real zero Real.zero✝.","effect_on_target":"It supplies the real value denoted by the numeral 0 in the product 0 * r.","status":"understood"},{"id":"D011","name":"Zero.toOfNat0","meaning":"This definition constructs the interpretation of the numeral 0 from a type's distinguished Zero value.","effect_on_target":"It ensures that the left factor is the distinguished real number 0.","status":"understood"},{"id":"D012","name":"instHMul","meaning":"This definition turns ordinary same-type multiplication into a homogeneous HMul instance.","effect_on_target":"It connects HMul.hMul to Real.instMul, so the displayed product is ordinary real multiplication of 0 and r.","status":"understood"}],"translation":{"binders":["An existentially quantified variable r ranging over the real numbers, within the proposition being negated."],"hypotheses":[],"conclusions":["There does not exist a real number r such that 0 multiplied by r equals 1."],"mathematical_definitions":["The numerals 0 and 1 denote the distinguished real zero and real one, respectively.","The product 0 * r uses real multiplication.","The outer negation means that existence of such an r would imply False."],"proposition_plain_english":"No real number r satisfies the equation 0 · r = 1."},"restrictions_and_vacuity_risks":["The assertion excludes solutions only in the domain of real numbers.","There are no explicit hypotheses whose inconsistency could make the proposition vacuously true; the negation directly rejects an existential witness.","The dependency inventory identifies primitive real zero, one, and multiplication but does not itself state their algebraic laws, so the proposition's truth is not derivable from this dossier alone."],"ambiguities":[]}
